{
  "schema_version": "0.1",
  "benchmark": "blockpush-2d-v0.1",
  "results": [
    {
      "schema_version": "0.1",
      "model_id": "oracle-simulator",
      "benchmark": "blockpush-2d-v0.1",
      "contexts": 12,
      "metrics": {
        "action_dependence": 1.0,
        "action_dependence_permutation_effect": 2.1138324205383303,
        "action_dependence_permutation_p_value": 0.016666666666666666,
        "counterfactual_direction_accuracy": 1.0,
        "noop_stability": 1.0,
        "state_ade": 0.0,
        "state_fde": 0.0,
        "candidate_ranking_spearman": 1.0,
        "candidate_ranking_kendall_tau": 1.0,
        "candidate_ranking_ndcg": 1.0,
        "candidate_ranking_pairwise_accuracy": 1.0,
        "top1_regret": 0.0
      },
      "context_results": [
        {
          "context_id": "blockpush-context-0000",
          "selected_action": "push-right",
          "optimal_action": "push-right",
          "top1_regret": 0.0,
          "metrics": {
            "action_dependence": 1.0,
            "action_dependence_permutation_effect": 2.1138324205383303,
            "action_dependence_permutation_p_value": 0.016666666666666666,
            "counterfactual_direction_accuracy": 1.0,
            "noop_stability": 1.0,
            "state_ade": 0.0,
            "state_fde": 0.0,
            "candidate_ranking_spearman": 1.0,
            "candidate_ranking_kendall_tau": 1.0,
            "candidate_ranking_ndcg": 1.0,
            "candidate_ranking_pairwise_accuracy": 1.0,
            "top1_regret": 0.0
          }
        },
        {
          "context_id": "blockpush-context-0001",
          "selected_action": "push-left",
          "optimal_action": "push-left",
          "top1_regret": 0.0,
          "metrics": {
            "action_dependence": 1.0,
            "action_dependence_permutation_effect": 2.1138324205383303,
            "action_dependence_permutation_p_value": 0.016666666666666666,
            "counterfactual_direction_accuracy": 1.0,
            "noop_stability": 1.0,
            "state_ade": 0.0,
            "state_fde": 0.0,
            "candidate_ranking_spearman": 1.0,
            "candidate_ranking_kendall_tau": 1.0,
            "candidate_ranking_ndcg": 1.0,
            "candidate_ranking_pairwise_accuracy": 1.0,
            "top1_regret": 0.0
          }
        },
        {
          "context_id": "blockpush-context-0002",
          "selected_action": "push-up",
          "optimal_action": "push-up",
          "top1_regret": 0.0,
          "metrics": {
            "action_dependence": 1.0,
            "action_dependence_permutation_effect": 2.1138324205383303,
            "action_dependence_permutation_p_value": 0.016666666666666666,
            "counterfactual_direction_accuracy": 1.0,
            "noop_stability": 1.0,
            "state_ade": 0.0,
            "state_fde": 0.0,
            "candidate_ranking_spearman": 1.0,
            "candidate_ranking_kendall_tau": 1.0,
            "candidate_ranking_ndcg": 1.0,
            "candidate_ranking_pairwise_accuracy": 1.0,
            "top1_regret": 0.0
          }
        },
        {
          "context_id": "blockpush-context-0003",
          "selected_action": "push-down",
          "optimal_action": "push-down",
          "top1_regret": 0.0,
          "metrics": {
            "action_dependence": 1.0,
            "action_dependence_permutation_effect": 2.1138324205383303,
            "action_dependence_permutation_p_value": 0.016666666666666666,
            "counterfactual_direction_accuracy": 1.0,
            "noop_stability": 1.0,
            "state_ade": 0.0,
            "state_fde": 0.0,
            "candidate_ranking_spearman": 1.0,
            "candidate_ranking_kendall_tau": 1.0,
            "candidate_ranking_ndcg": 1.0,
            "candidate_ranking_pairwise_accuracy": 1.0,
            "top1_regret": 0.0
          }
        },
        {
          "context_id": "blockpush-context-0004",
          "selected_action": "push-right",
          "optimal_action": "push-right",
          "top1_regret": 0.0,
          "metrics": {
            "action_dependence": 1.0,
            "action_dependence_permutation_effect": 2.1138324205383303,
            "action_dependence_permutation_p_value": 0.016666666666666666,
            "counterfactual_direction_accuracy": 1.0,
            "noop_stability": 1.0,
            "state_ade": 0.0,
            "state_fde": 0.0,
            "candidate_ranking_spearman": 1.0,
            "candidate_ranking_kendall_tau": 1.0,
            "candidate_ranking_ndcg": 1.0,
            "candidate_ranking_pairwise_accuracy": 1.0,
            "top1_regret": 0.0
          }
        },
        {
          "context_id": "blockpush-context-0005",
          "selected_action": "push-left",
          "optimal_action": "push-left",
          "top1_regret": 0.0,
          "metrics": {
            "action_dependence": 1.0,
            "action_dependence_permutation_effect": 2.1138324205383303,
            "action_dependence_permutation_p_value": 0.016666666666666666,
            "counterfactual_direction_accuracy": 1.0,
            "noop_stability": 1.0,
            "state_ade": 0.0,
            "state_fde": 0.0,
            "candidate_ranking_spearman": 1.0,
            "candidate_ranking_kendall_tau": 1.0,
            "candidate_ranking_ndcg": 1.0,
            "candidate_ranking_pairwise_accuracy": 1.0,
            "top1_regret": 0.0
          }
        },
        {
          "context_id": "blockpush-context-0006",
          "selected_action": "push-up",
          "optimal_action": "push-up",
          "top1_regret": 0.0,
          "metrics": {
            "action_dependence": 1.0,
            "action_dependence_permutation_effect": 2.1138324205383303,
            "action_dependence_permutation_p_value": 0.016666666666666666,
            "counterfactual_direction_accuracy": 1.0,
            "noop_stability": 1.0,
            "state_ade": 0.0,
            "state_fde": 0.0,
            "candidate_ranking_spearman": 1.0,
            "candidate_ranking_kendall_tau": 1.0,
            "candidate_ranking_ndcg": 1.0,
            "candidate_ranking_pairwise_accuracy": 1.0,
            "top1_regret": 0.0
          }
        },
        {
          "context_id": "blockpush-context-0007",
          "selected_action": "push-down",
          "optimal_action": "push-down",
          "top1_regret": 0.0,
          "metrics": {
            "action_dependence": 1.0,
            "action_dependence_permutation_effect": 2.1138324205383303,
            "action_dependence_permutation_p_value": 0.016666666666666666,
            "counterfactual_direction_accuracy": 1.0,
            "noop_stability": 1.0,
            "state_ade": 0.0,
            "state_fde": 0.0,
            "candidate_ranking_spearman": 1.0,
            "candidate_ranking_kendall_tau": 1.0,
            "candidate_ranking_ndcg": 1.0,
            "candidate_ranking_pairwise_accuracy": 1.0,
            "top1_regret": 0.0
          }
        },
        {
          "context_id": "blockpush-context-0008",
          "selected_action": "push-right",
          "optimal_action": "push-right",
          "top1_regret": 0.0,
          "metrics": {
            "action_dependence": 1.0,
            "action_dependence_permutation_effect": 2.1138324205383303,
            "action_dependence_permutation_p_value": 0.016666666666666666,
            "counterfactual_direction_accuracy": 1.0,
            "noop_stability": 1.0,
            "state_ade": 0.0,
            "state_fde": 0.0,
            "candidate_ranking_spearman": 1.0,
            "candidate_ranking_kendall_tau": 1.0,
            "candidate_ranking_ndcg": 1.0,
            "candidate_ranking_pairwise_accuracy": 1.0,
            "top1_regret": 0.0
          }
        },
        {
          "context_id": "blockpush-context-0009",
          "selected_action": "push-left",
          "optimal_action": "push-left",
          "top1_regret": 0.0,
          "metrics": {
            "action_dependence": 1.0,
            "action_dependence_permutation_effect": 2.1138324205383303,
            "action_dependence_permutation_p_value": 0.016666666666666666,
            "counterfactual_direction_accuracy": 1.0,
            "noop_stability": 1.0,
            "state_ade": 0.0,
            "state_fde": 0.0,
            "candidate_ranking_spearman": 1.0,
            "candidate_ranking_kendall_tau": 1.0,
            "candidate_ranking_ndcg": 1.0,
            "candidate_ranking_pairwise_accuracy": 1.0,
            "top1_regret": 0.0
          }
        },
        {
          "context_id": "blockpush-context-0010",
          "selected_action": "push-up",
          "optimal_action": "push-up",
          "top1_regret": 0.0,
          "metrics": {
            "action_dependence": 1.0,
            "action_dependence_permutation_effect": 2.1138324205383303,
            "action_dependence_permutation_p_value": 0.016666666666666666,
            "counterfactual_direction_accuracy": 1.0,
            "noop_stability": 1.0,
            "state_ade": 0.0,
            "state_fde": 0.0,
            "candidate_ranking_spearman": 1.0,
            "candidate_ranking_kendall_tau": 1.0,
            "candidate_ranking_ndcg": 1.0,
            "candidate_ranking_pairwise_accuracy": 1.0,
            "top1_regret": 0.0
          }
        },
        {
          "context_id": "blockpush-context-0011",
          "selected_action": "push-down",
          "optimal_action": "push-down",
          "top1_regret": 0.0,
          "metrics": {
            "action_dependence": 1.0,
            "action_dependence_permutation_effect": 2.1138324205383303,
            "action_dependence_permutation_p_value": 0.016666666666666666,
            "counterfactual_direction_accuracy": 1.0,
            "noop_stability": 1.0,
            "state_ade": 0.0,
            "state_fde": 0.0,
            "candidate_ranking_spearman": 1.0,
            "candidate_ranking_kendall_tau": 1.0,